{
  "version": "runar-v0.5.0",
  "compilerVersion": "0.5.0-go",
  "contractName": "StateRead",
  "parentClass": "StatefulSmartContract",
  "abi": {
    "constructor": {
      "params": [
        {
          "name": "s",
          "type": "ByteString"
        }
      ]
    },
    "methods": [
      {
        "name": "update",
        "params": [
          {
            "name": "ns",
            "type": "ByteString"
          },
          {
            "name": "_changePKH",
            "type": "Ripemd160"
          },
          {
            "name": "_changeAmount",
            "type": "bigint"
          },
          {
            "name": "_newAmount",
            "type": "bigint"
          },
          {
            "name": "txPreimage",
            "type": "SigHashPreimage"
          }
        ],
        "isPublic": true,
        "usesCodePart": true
      },
      {
        "name": "termCheck",
        "params": [
          {
            "name": "expected",
            "type": "ByteString"
          },
          {
            "name": "txPreimage",
            "type": "SigHashPreimage"
          }
        ],
        "isPublic": true,
        "isTerminal": true,
        "usesCodePart": true
      }
    ]
  },
  "script": "76009c637576ab567a210279be667ef9dcbbac55a06295ce870b07029bfcdb2dce28d959f2815b16f81798ad697601687f7782012c947f758258947f75517f7c01007e817602fd009f6375677602fe009c6375547f77677602ff009c6375587f776775527f776868685679827700947f77517f7c8176014c9f637f6776014d9c6375527f7c817f6775517f7c817f686875557a77547a547a041976a9147b7e0288ac7e7c58807c7e7c8276014c9f635280517f757c7e67760200019f635280517f75014c7c7e7c7e675480527f75014d7c7e7c7e68685279547a7c7558806b5379016a7e7c7e827602fd009f635280517f756776030000019f635380527f7501fd7c7e67760500000000019f635580547f7501fe7c7e675980587f7501ff7c7e6868687c7e6c7c7e7c7eaa7c820128947f7701207f75877767519d76ab537a210279be667ef9dcbbac55a06295ce870b07029bfcdb2dce28d959f2815b16f81798ad6901687f7782012c947f758258947f75517f7c01007e817602fd009f6375677602fe009c6375547f77677602ff009c6375587f776775527f776868685279827700947f77517f7c8176014c9f637f6776014d9c6375527f7c817f6775517f7c817f686875765801147b7b7f777c7f757b87777768",
  "asm": "OP_DUP OP_0 OP_NUMEQUAL OP_IF OP_DROP OP_DUP OP_CODESEPARATOR OP_6 OP_ROLL \u003c0279be667ef9dcbbac55a06295ce870b07029bfcdb2dce28d959f2815b16f81798\u003e OP_CHECKSIGVERIFY OP_VERIFY OP_DUP \u003c68\u003e OP_SPLIT OP_NIP OP_SIZE \u003c2c\u003e OP_SUB OP_SPLIT OP_DROP OP_SIZE OP_8 OP_SUB OP_SPLIT OP_DROP OP_1 OP_SPLIT OP_SWAP \u003c00\u003e OP_CAT OP_BIN2NUM OP_DUP \u003cfd00\u003e OP_LESSTHAN OP_IF OP_DROP OP_ELSE OP_DUP \u003cfe00\u003e OP_NUMEQUAL OP_IF OP_DROP OP_4 OP_SPLIT OP_NIP OP_ELSE OP_DUP \u003cff00\u003e OP_NUMEQUAL OP_IF OP_DROP OP_8 OP_SPLIT OP_NIP OP_ELSE OP_DROP OP_2 OP_SPLIT OP_NIP OP_ENDIF OP_ENDIF OP_ENDIF OP_6 OP_PICK OP_SIZE OP_NIP OP_0 OP_SUB OP_SPLIT OP_NIP OP_1 OP_SPLIT OP_SWAP OP_BIN2NUM OP_DUP \u003c4c\u003e OP_LESSTHAN OP_IF OP_SPLIT OP_ELSE OP_DUP \u003c4d\u003e OP_NUMEQUAL OP_IF OP_DROP OP_2 OP_SPLIT OP_SWAP OP_BIN2NUM OP_SPLIT OP_ELSE OP_DROP OP_1 OP_SPLIT OP_SWAP OP_BIN2NUM OP_SPLIT OP_ENDIF OP_ENDIF OP_DROP OP_5 OP_ROLL OP_NIP OP_4 OP_ROLL OP_4 OP_ROLL \u003c1976a914\u003e OP_ROT OP_CAT \u003c88ac\u003e OP_CAT OP_SWAP OP_8 OP_NUM2BIN OP_SWAP OP_CAT OP_SWAP OP_SIZE OP_DUP \u003c4c\u003e OP_LESSTHAN OP_IF OP_2 OP_NUM2BIN OP_1 OP_SPLIT OP_DROP OP_SWAP OP_CAT OP_ELSE OP_DUP \u003c0001\u003e OP_LESSTHAN OP_IF OP_2 OP_NUM2BIN OP_1 OP_SPLIT OP_DROP \u003c4c\u003e OP_SWAP OP_CAT OP_SWAP OP_CAT OP_ELSE OP_4 OP_NUM2BIN OP_2 OP_SPLIT OP_DROP \u003c4d\u003e OP_SWAP OP_CAT OP_SWAP OP_CAT OP_ENDIF OP_ENDIF OP_2 OP_PICK OP_4 OP_ROLL OP_SWAP OP_DROP OP_8 OP_NUM2BIN OP_TOALTSTACK OP_3 OP_PICK \u003c6a\u003e OP_CAT OP_SWAP OP_CAT OP_SIZE OP_DUP \u003cfd00\u003e OP_LESSTHAN OP_IF OP_2 OP_NUM2BIN OP_1 OP_SPLIT OP_DROP OP_ELSE OP_DUP \u003c000001\u003e OP_LESSTHAN OP_IF OP_3 OP_NUM2BIN OP_2 OP_SPLIT OP_DROP \u003cfd\u003e OP_SWAP OP_CAT OP_ELSE OP_DUP \u003c0000000001\u003e OP_LESSTHAN OP_IF OP_5 OP_NUM2BIN OP_4 OP_SPLIT OP_DROP \u003cfe\u003e OP_SWAP OP_CAT OP_ELSE OP_9 OP_NUM2BIN OP_8 OP_SPLIT OP_DROP \u003cff\u003e OP_SWAP OP_CAT OP_ENDIF OP_ENDIF OP_ENDIF OP_SWAP OP_CAT OP_FROMALTSTACK OP_SWAP OP_CAT OP_SWAP OP_CAT OP_HASH256 OP_SWAP OP_SIZE \u003c28\u003e OP_SUB OP_SPLIT OP_NIP \u003c20\u003e OP_SPLIT OP_DROP OP_EQUAL OP_NIP OP_ELSE OP_1 OP_NUMEQUALVERIFY OP_DUP OP_CODESEPARATOR OP_3 OP_ROLL \u003c0279be667ef9dcbbac55a06295ce870b07029bfcdb2dce28d959f2815b16f81798\u003e OP_CHECKSIGVERIFY OP_VERIFY \u003c68\u003e OP_SPLIT OP_NIP OP_SIZE \u003c2c\u003e OP_SUB OP_SPLIT OP_DROP OP_SIZE OP_8 OP_SUB OP_SPLIT OP_DROP OP_1 OP_SPLIT OP_SWAP \u003c00\u003e OP_CAT OP_BIN2NUM OP_DUP \u003cfd00\u003e OP_LESSTHAN OP_IF OP_DROP OP_ELSE OP_DUP \u003cfe00\u003e OP_NUMEQUAL OP_IF OP_DROP OP_4 OP_SPLIT OP_NIP OP_ELSE OP_DUP \u003cff00\u003e OP_NUMEQUAL OP_IF OP_DROP OP_8 OP_SPLIT OP_NIP OP_ELSE OP_DROP OP_2 OP_SPLIT OP_NIP OP_ENDIF OP_ENDIF OP_ENDIF OP_2 OP_PICK OP_SIZE OP_NIP OP_0 OP_SUB OP_SPLIT OP_NIP OP_1 OP_SPLIT OP_SWAP OP_BIN2NUM OP_DUP \u003c4c\u003e OP_LESSTHAN OP_IF OP_SPLIT OP_ELSE OP_DUP \u003c4d\u003e OP_NUMEQUAL OP_IF OP_DROP OP_2 OP_SPLIT OP_SWAP OP_BIN2NUM OP_SPLIT OP_ELSE OP_DROP OP_1 OP_SPLIT OP_SWAP OP_BIN2NUM OP_SPLIT OP_ENDIF OP_ENDIF OP_DROP OP_DUP OP_8 \u003c14\u003e OP_ROT OP_ROT OP_SPLIT OP_NIP OP_SWAP OP_SPLIT OP_DROP OP_ROT OP_EQUAL OP_NIP OP_NIP OP_ENDIF",
  "stateFields": [
    {
      "name": "s",
      "type": "ByteString",
      "index": 0
    }
  ],
  "codeSepIndexSlots": [
    {
      "byteOffset": 109,
      "codeSepIndex": 6
    },
    {
      "byteOffset": 418,
      "codeSepIndex": 316
    }
  ],
  "codeSeparatorIndex": 316,
  "codeSeparatorIndices": [
    6,
    316
  ],
  "buildTimestamp": "2026-06-22T00:04:51Z",
  "anf": {
    "contractName": "StateRead",
    "properties": [
      {
        "name": "s",
        "type": "ByteString",
        "readonly": false
      }
    ],
    "methods": [
      {
        "name": "constructor",
        "params": [
          {
            "name": "s",
            "type": "ByteString"
          }
        ],
        "body": [
          {
            "name": "t0",
            "value": {
              "kind": "load_prop",
              "name": "s"
            },
            "sourceLoc": {
              "file": "/tmp/j100/StateRead.runar.ts",
              "line": 5,
              "column": 31
            }
          },
          {
            "name": "t1",
            "value": {
              "args": [
                "t0"
              ],
              "func": "super",
              "kind": "call"
            },
            "sourceLoc": {
              "file": "/tmp/j100/StateRead.runar.ts",
              "line": 5,
              "column": 31
            }
          },
          {
            "name": "t2",
            "value": {
              "kind": "load_prop",
              "name": "s"
            },
            "sourceLoc": {
              "file": "/tmp/j100/StateRead.runar.ts",
              "line": 5,
              "column": 41
            }
          },
          {
            "name": "t3",
            "value": {
              "kind": "update_prop",
              "name": "s",
              "value": "t2"
            },
            "sourceLoc": {
              "file": "/tmp/j100/StateRead.runar.ts",
              "line": 5,
              "column": 41
            }
          }
        ],
        "isPublic": false
      },
      {
        "name": "update",
        "params": [
          {
            "name": "ns",
            "type": "ByteString"
          },
          {
            "name": "_changePKH",
            "type": "Ripemd160"
          },
          {
            "name": "_changeAmount",
            "type": "bigint"
          },
          {
            "name": "_newAmount",
            "type": "bigint"
          },
          {
            "name": "txPreimage",
            "type": "SigHashPreimage"
          }
        ],
        "body": [
          {
            "name": "t0",
            "value": {
              "kind": "load_param",
              "name": "txPreimage"
            }
          },
          {
            "name": "t1",
            "value": {
              "kind": "check_preimage",
              "preimage": "t0"
            }
          },
          {
            "name": "t2",
            "value": {
              "kind": "assert",
              "value": "t1"
            }
          },
          {
            "name": "t3",
            "value": {
              "kind": "load_param",
              "name": "txPreimage"
            }
          },
          {
            "name": "t4",
            "value": {
              "kind": "deserialize_state",
              "preimage": "t3"
            }
          },
          {
            "name": "t5",
            "value": {
              "kind": "load_param",
              "name": "ns"
            },
            "sourceLoc": {
              "file": "/tmp/j100/StateRead.runar.ts",
              "line": 6,
              "column": 40
            }
          },
          {
            "name": "t6",
            "value": {
              "kind": "update_prop",
              "name": "s",
              "value": "t5"
            },
            "sourceLoc": {
              "file": "/tmp/j100/StateRead.runar.ts",
              "line": 6,
              "column": 40
            }
          },
          {
            "name": "t7",
            "value": {
              "kind": "load_param",
              "name": "_changePKH"
            }
          },
          {
            "name": "t8",
            "value": {
              "kind": "load_param",
              "name": "_changeAmount"
            }
          },
          {
            "name": "t9",
            "value": {
              "args": [
                "t7",
                "t8"
              ],
              "func": "buildChangeOutput",
              "kind": "call"
            }
          },